{
  "schemaVersion": "sovereign-skin-layer/1.0",
  "id": "fox-anime-whole-body-skin-v1",
  "version": "1.0.0",
  "bodyCoverage": "whole-body",
  "rigId": "fox-quadruped-v1",
  "sculptDocumentId": "fox-fixture-v1",
  "topologyDigest": "d3db553ea7bfa0379d707c31d70d4cf433de82fb7ee09f790da76e48f4836696",
  "uvDigest": "2ad2d350c554666077e69f0ab0ba5b0b7662982060e39040a508525b97bce65d",
  "materialRegions": [
    {
      "id": "whole-body",
      "sculptRegionId": "body",
      "materialId": "anime-cel-body"
    }
  ],
  "textureChannels": {
    "baseColor": {
      "assetRef": "asset://non-production/fox/base-color.png",
      "digest": "9a16f0a2c6fe273ed082a38324b06b1972b023632c3ab8a653cfafad65368857",
      "mimeType": "image/png",
      "colorSpace": "srgb"
    },
    "celShade": {
      "assetRef": "asset://non-production/fox/cel-shade.png",
      "digest": "0f8bf81ce7c72c4ae4638156bf3704573ff3d2e7f0b41f24abc78870171f1a83",
      "mimeType": "image/png",
      "colorSpace": "srgb"
    },
    "normalDetail": {
      "assetRef": "asset://non-production/fox/normal-detail.png",
      "digest": "a441cdefcaa5b8afeb21e13a27bef06d5a7567be4560a952b43d8b94964dd839",
      "mimeType": "image/png",
      "colorSpace": "linear"
    },
    "roughness": {
      "assetRef": "asset://non-production/fox/roughness.png",
      "digest": "ed67e1dbbc460fbfdd76c60b37fa5c03d36e9c52f56f1d12a98fb9353addf8c7",
      "mimeType": "image/png",
      "colorSpace": "linear"
    },
    "fur": {
      "assetRef": "asset://non-production/fox/fur.png",
      "digest": "1e0c9fecfed0abf3264e56d1057ce421436ee117b2299cdfc81cb10ac00f7f2e",
      "mimeType": "image/png",
      "colorSpace": "srgb"
    },
    "marking": {
      "assetRef": "asset://non-production/fox/marking.png",
      "digest": "2d95381dd88d874dada13744192dce4a639946026dd0f785800a7a7de95552f1",
      "mimeType": "image/png",
      "colorSpace": "srgb"
    }
  },
  "generationProvenance": {
    "method": "governed-model",
    "generatorId": "mandala-anime-surface-painter-fixture",
    "generatorVersion": "1.0.0",
    "authorityRef": "authority://fixture-operator",
    "rightsRef": "rights://non-production-original-fixture",
    "inputDigests": [
      "4e511f5a5d52d87e9f793516a689918412c16d67a9cd6bca3d8ccec0ce690c41"
    ]
  },
  "surfaceOnly": true,
  "anatomyMutationAllowed": false
}
